{
  "$schema": "http://json-schema.org/draft-07/schema#",
  "$id": "https://aeo-agency.example.com/schemas/issues.json",
  "title": "Issues",
  "description": "Schema for detected AEO issues and recommendations",
  "type": "object",
  "required": ["website_url", "generated_at", "issues"],
  "properties": {
    "website_url": {
      "type": "string",
      "format": "uri"
    },
    "generated_at": {
      "type": "string",
      "format": "date-time"
    },
    "summary": {
      "type": "object",
      "properties": {
        "total_issues": {"type": "integer"},
        "critical_count": {"type": "integer"},
        "warning_count": {"type": "integer"},
        "info_count": {"type": "integer"},
        "score": {"type": "integer", "minimum": 0, "maximum": 100}
      }
    },
    "issues": {
      "type": "array",
      "items": {
        "type": "object",
        "required": ["id", "severity", "category", "title", "description"],
        "properties": {
          "id": {"type": "string"},
          "severity": {
            "type": "string",
            "enum": ["critical", "warning", "info"]
          },
          "category": {
            "type": "string",
            "enum": ["technical", "content", "structure", "structured_data", "authority", "accessibility"]
          },
          "title": {"type": "string"},
          "description": {"type": "string"},
          "affected_pages": {
            "type": "array",
            "items": {"type": "string"}
          },
          "recommendation": {"type": "string"},
          "effort_estimate": {
            "type": "string",
            "enum": ["low", "medium", "high"]
          }
        }
      }
    }
  }
}
